"","id","text","lang","author_id","created_at","clean_text","created_at_round"
"70","1578460194190905356","The Ministry of Health has stepped up Ebola screening at Entebbe International airport following the outbreak of the disease in the country. 

#NTVNews

👉https://t.co/CcRLjECEtk https://t.co/chCbZ0TP3S","en","109220563",2022-10-07 19:00:11,"the ministry of health has stepped up ebola screening at entebbe international airpo following the outbreak of the disease in the country   ntvnews  ",2022-10-07 19:00:00
"71","1578460175400591361","The United States will begin screening travelers coming from Uganda for Ebola as an additional precaution aimed at trying to prevent an outbreak in the African country from spreading, the Biden administration said Thursday. https://t.co/04JX7keoru","en","16028049",2022-10-07 19:00:06,"the united states will begin screening travelers coming from uganda for ebola as an additional precaution aimed at trying to prevent an outbreak in the african country from spreading the biden administration said thursday",2022-10-07 19:00:00
"72","1578460151224274944","In response to an Ebola outbreak in Uganda, CDC issued a health advisory recommending health providers prepare for patients infected with the Ebola virus and ordered all flights from Uganda be redirected to specific airports for health screenings
https://t.co/BST4kFphrW","en","50655319",2022-10-07 19:00:01,"in response to an ebola outbreak in uganda cdc issued a health advisory recommending health providers prepare for patients infected with the ebola virus and ordered all flights from uganda be redirected to specific airpos for health screenings ",2022-10-07 19:00:00
"73","1578459965815422976","CDC Asks U.S. Physicians To Monitor For Ebola As Uganda Outbreak Grows https://t.co/gBoi6amsSi","en","1352234446402048003",2022-10-07 18:59:16,"cdc asks us physicians to monitor for ebola as uganda outbreakgrows",2022-10-07 19:00:00
"74","1578459700521103361","@lisa_iannattone @PollyNZ1 I rarely see Hanta virus mention when Ebola is around. A hemorrhagic horror very similar to Ebola ,it recurs about every 20yrs in indigenous communities in the west","en","2810873309",2022-10-07 18:58:13,"i rarely see hanta virus mention when ebola is around a hemorrhagic horror very similar to ebola it recurs about every yrs in indigenous communities in the west",2022-10-07 19:00:00
"75","1578459621085220864","@LauraMiers @sleepyknave @lisa_iannattone Wait. So:
CDC: “Ebola is *not* a respiratory virus so it is not transmitted through the air”

Also CDC: “Covid *is* a respiratory virus transmitted by ..... droplets ....”

I don’t know what this is but it isn’t science! https://t.co/hJTHKzYkrO","en","1401216844414001157",2022-10-07 18:57:54,"wait so cdc ebola is not a respiratory virus so it is not transmitted through the air  also cdc covid is a respiratory virus transmitted bydroplets   i dont know what this is but it isnt science",2022-10-07 19:00:00
"76","1578458718529679360","Please ask Biden to close the borders so Covid stops coming in and EBOLA doesn’t sneak in there’s no vaccine for that…. https://t.co/aJ9SrFXPYz","en","1464568252370198539",2022-10-07 18:54:19,"please ask biden to close the borders so covid stops coming in and ebola doesnt sneak in theres no vaccine for that",2022-10-07 19:00:00
"77","1578458641610702848","As an Ebola outbreak in Africa worsens, the Biden administration has ordered all travelers from Uganda to land at five U.S. airports for health screenings. https://t.co/vwfAUkyoTS https://t.co/r5GIFlz3sR","en","419111219",2022-10-07 18:54:01,"as an ebola outbreak in africa worsens the biden administration has ordered all travelers from uganda to land at five us airpos for health screenings",2022-10-07 19:00:00
"78","1578458494629343232","WebMD: As an Ebola outbreak in Africa worsens, the Biden administration has ordered all travelers from Uganda to land at five U.S. airports for health screenings. https://t.co/DMgxXbQtQp https://t.co/52Zdrqv4HA https://t.co/7HmXEN4KWF","en","321649323",2022-10-07 18:53:26,"webmd as an ebola outbreak in africa worsens the biden administration has ordered all travelers from uganda to land at five us airpos for health screenings",2022-10-07 19:00:00
"79","1578458477873156096","@itosettiMD_MBA @NjbBari3 Ebola anxiety?","en","1351635026383937543",2022-10-07 18:53:22,"ebola anxiety",2022-10-07 19:00:00
"80","1578458373384962049","This is scary if true😱

https://t.co/pi8bkjLwHk","en","1379069894164160515",2022-10-07 18:52:57,"this is scary if true  ",2022-10-07 19:00:00
"81","1578458279013150720","@WHO @MinofHealthUG @MugenyiHenry_ This follows an advisory in which the United States government announced all travellers arriving from Uganda would be exposed to screening for Ebola Virus Disease.

#NBSLiveAt9 #NBSUpdates","en","344718893",2022-10-07 18:52:34,"this follows an advisory in which the united states government announced all travellers arriving from uganda would be exposed to screening for ebola virus disease  nbsliveat nbsupdates",2022-10-07 19:00:00
"82","1578458253910212608","@AugustFairyyy @ReecyAtuhaire How's the Ebola situation","en","1536737749662941184",2022-10-07 18:52:28,"hows the ebola situation",2022-10-07 19:00:00
"83","1578458217369280512",".@WHO and @MinofHealthUG have assured the world that there is no need to panic since the Ebola Virus Disease has been contained from spreading in Uganda.

@MugenyiHenry_

#NBSLiveAt9 #NBSUpdates https://t.co/Vxxa3c1PCx","en","344718893",2022-10-07 18:52:20,"andhave assured the world that there is no need to panic since the ebola virus disease has been contained from spreading in uganda    nbsliveat nbsupdates",2022-10-07 19:00:00
"84","1578458214701506560","""We need a new biological weapons treaty"" before it's too late.

Ebola: This is Not ""Over"" https://t.co/5PGhFK6FSc","en","133396097",2022-10-07 18:52:19,"we need a new biological weapons treaty before its too late  ebola this is not over",2022-10-07 19:00:00
"85","1578458170627792896","Health workers among dead in Ugandan Ebola outbreak https://t.co/3o8rOV18dk #Uganda","en","56399493",2022-10-07 18:52:08,"health workers among dead in ugandan ebola outbreakuganda",2022-10-07 19:00:00
"86","1578458122594590721","@_marching_Ents_ #auspol Nah they'll let it rip through population just like covid19 &amp; similarly our govt will try to convince us we were always going to get Ebola anyway! There was a report done for parliament back in 1994 on quarantine &amp; disease control &amp; like now, govts ignored it.","en","800262170",2022-10-07 18:51:57,"auspol nah theyll let it rip through population just like covid amp similarly our govt will try to convince us we were always going to get ebola anyway there was a repo done for parliament back inon quarantine amp disease control amp like now govts ignored it",2022-10-07 19:00:00
"87","1578458044572217344","Get Horror Games 🔥""EBOLA 3""🔥 for Free on https://t.co/IPy6rKVMzd‼️⬇️

👉https://t.co/RlM83crtN5

⏰FREE for a limited time! https://t.co/x7BSFZRSwf","en","3937140976",2022-10-07 18:51:38,"get horror games ebolafor free on     free for a limited time",2022-10-07 19:00:00
"88","1578458034237767680","@KBCChannel1 Uganda infected with Ebola ,Malawi infected with Polio , Mozambique infected with Monkey pox https://t.co/12zpZZ9fvU","en","1355966975403581442",2022-10-07 18:51:36,"uganda infected with ebola malawi infected with poliomozambique infected with monkey pox",2022-10-07 19:00:00
"89","1578458007939485698","@FinchTH Every time I read SARS/Ebola/MPX is transmitted by ""close contact"" I ask myself what the f**k is close contact? And how by what physics does close contact transmit a virus? And why does that take exactly 15 minutes? 🤣","en","1325893922",2022-10-07 18:51:30,"every time i read sarsebolampx is transmitted by close contact i ask myself what the fk is close contact and how by what physics does close contact transmit a virus and why does that take exactlyminutes",2022-10-07 19:00:00
"90","1578457925718224896","Yeah and heard that there is some concern about Ebola virus in the world again they are screening for it in legal entry. so prayer it doesn’t come across our borders that ate open and no screening there for it https://t.co/nqCt5sENUb","en","1464568252370198539",2022-10-07 18:51:10,"yeah and heard that there is some concern about ebola virus in the world again they are screening for it in legal entry so prayer it doesnt come across our borders that ate open and no screening there for it",2022-10-07 19:00:00
"91","1578457911872798720","@PierrePoilievre Pierre, how might you handle a global Ebola outbreak? Asking for those struggling to contain a recent outbreak in Africa.","en","1529494704055898114",2022-10-07 18:51:07,"pierre how might you handle a global ebola outbreak asking for those struggling to contain a recent outbreak in africa",2022-10-07 19:00:00
"92","1578457851428999168","Paragraph 4... https://t.co/aLyTSyQ34Y","en","291349358",2022-10-07 18:50:52,"paragraph",2022-10-07 19:00:00
"93","1578457612433215512","Is testing passengers enough to control the spread of Ebola? https://t.co/s55xrOKsNI","en","42106416",2022-10-07 18:49:55,"is testing passengers enough to control the spread of ebola",2022-10-07 19:00:00
"94","1578457507735166977","Oh wonderful, Ebola is trending on twitter. That is exactly what we need right now. https://t.co/NjYCU2wUmg","en","113108685",2022-10-07 18:49:30,"oh wonderful ebola is trending on twitter that is exactly what we need right now",2022-10-07 19:00:00
"95","1578457492279164930","@TheSkylineTrail @sleepyknave @lisa_iannattone “Quiz” &amp; “Key Facts” on the CDC’s Ebola page. https://t.co/aCSBdiTYOB https://t.co/uMPt9cAboR","en","170280910",2022-10-07 18:49:27,"quiz amp key facts on the cdcs ebola page",2022-10-07 19:00:00
"96","1578457470682660864","Health workers among 29 killed in Uganda Ebola outbreak https://t.co/UXl1R4sSR0 via @RFI_En #UGA","en","44329534",2022-10-07 18:49:21,"health workers amongkilled in uganda ebola outbreakviauga",2022-10-07 19:00:00
"97","1578457441133481984","@ScienceBotikus Whoa! Did you know:  The Ebola virus kills 4 out of every 5 humans it infects. @ScienceBotikus","en","1452689952018509828",2022-10-07 18:49:14,"whoa did you knowthe ebola virus killsout of everyhumans it infects",2022-10-07 19:00:00
"98","1578457020084424705","U.S. to Screen Travelers From Uganda for Ebola at 5 Airports - WebMD https://t.co/6F1fGTghnx","en","919198192868175873",2022-10-07 18:47:34,"us to screen travelers from uganda for ebola atairposwebmd",2022-10-07 19:00:00
"99","1578457013536686081","@tmcdonnell4 @white_bite Discussion at the processing center of the Underworld: ""thought my COVID was bad, and the monkeypox hurt like a mother, but it was the exsanguination from Ebola that did me in.""","en","375801620",2022-10-07 18:47:32,"discussion at the processing center of the underworld thought my covid was bad and the monkeypox hu like a mother but it was the exsanguination from ebola that did me in",2022-10-07 19:00:00
"100","1578456833983131649","""Clinicians with concerns about a patient with suspected EVD should contact their...health department immediately.... Early recognition &amp; identification of a suspected EVD patient under investigation (PUI) is critical...coordinate (with) CDC to prevent potential spread....""","en","1411668290154504196",2022-10-07 18:46:50,"clinicians with concerns about a patient with suspected evd should contact theirhealth depament immediately early recognition amp identification of a suspected evd patient under investigation pui is criticalcoordinate with cdc to prevent potential spread",2022-10-07 19:00:00
