"","id","text","lang","author_id","created_at","clean_text","created_at_round"
"1","1578468221744578560","Uganda: Ebola - ""Dr Christopher Mambula, programme manager for Médecins Sans Frontières (MSF) in Uganda, said the situation was 'very serious'. Cases were rising daily and it was still unclear how widely the virus had spread,.."" https://t.co/euPnHDZHqB h/t Pathfinder","en","19087092",2022-10-07 19:32:05,"uganda eboladr christopher mambula programme manager for médecins sans frontières msf in uganda said the situation was very serious cases were rising daily and it was still unclear how widely the virus had spreadht pathfinder",2022-10-07 20:00:00
"2","1578468017926656002","The Ebola virus kills 4 out of every 5 humans it infects.","en","1128063316511866881",2022-10-07 19:31:16,"the ebola virus killsout of everyhumans it infects",2022-10-07 20:00:00
"3","1578467851052101632","@RwothomioJulio3 @AIno_Mugisha Corona and ebola are still  there are 🤣🤣🤣🤣","en","1511242744475357184",2022-10-07 19:30:36,"corona and ebola are stillthere are",2022-10-07 20:00:00
"4","1578467727337230337","Biden Administration Orders Airport Ebola Screenings Amidst Deadly Ugandan Outbreak https://t.co/x9cR4dW9FI","en","18269496",2022-10-07 19:30:07,"biden administration orders airpo ebola screenings amidst deadly ugandan outbreak",2022-10-07 20:00:00
"5","1578467699537371136","NHS warns to be ‘vigilant’ against Ebola as America launches airport scan https://t.co/NMNEGEgz7E","en","1570548093052911616",2022-10-07 19:30:00,"nhs warns to be vigilant against ebola as america launches airposcan",2022-10-07 20:00:00
"6","1578467680331264000","@CTVNews does blackface groper have his own ""vaccine"" ready to go for ebola? 🤡🇨🇦","en","1492316303180378112",2022-10-07 19:29:56,"does blackface groper have his own vaccine ready to go for ebola",2022-10-07 19:00:00
"7","1578467534567002112","Ebola: This is Not ""Over"" https://t.co/xvpoHfa8vx","en","707938453",2022-10-07 19:29:21,"ebola this is not over",2022-10-07 19:00:00
"8","1578467517366173696","@SteveOfAmazing @crazydog55Donna @Bob31685906 @KateTalksTruth @elonmusk I bet you’ve never met someone who died of Ebola or tuberculosis so it must not be true they died from it since your personal experience triumphs over science 🙄🙄","en","1420054623814144007",2022-10-07 19:29:17,"i bet youve never met someone who died of ebola or tuberculosis so it must not be true they died from it since your personal experience triumphs over science",2022-10-07 19:00:00
"9","1578467480942440448","U.S. to screen passengers from Uganda for Ebola https://t.co/iR4amjhlWe","en","1571315050648055808",2022-10-07 19:29:08,"us to screen passengers from uganda forebola",2022-10-07 19:00:00
"10","1578467473749573632","@HH_LUFC Lucozade cured all when I were little, probably get over Ebola with a 1 litre bottle 😂","en","228776280",2022-10-07 19:29:06,"lucozade cured all when i were little probably get over ebola with alitre bottle",2022-10-07 19:00:00
"11","1578467301845880836","Biden Administration Orders Airport Ebola Screenings Amidst Deadly Ugandan Outbreak 
 
The Biden administration started screening travelers from Uganda for Ebola on Thursday amidst a deadly variant outbreak that has not...
https://t.co/XXD1qW2eaI","en","1333283589291601923",2022-10-07 19:28:25,"biden administration orders airpo ebola screenings amidst deadly ugandan outbreak    the biden administration staed screening travelers from uganda for ebola on thursday amidst a deadly variant outbreak that has not ",2022-10-07 19:00:00
"12","1578467201182760960","@CTVNews Now they're unleashing Ebola?","en","20896277",2022-10-07 19:28:01,"now theyre unleashing ebola",2022-10-07 19:00:00
"13","1578466904833826816","@FiatLuxGenesis Isn't there always Ebola in Uganda?","en","38509501",2022-10-07 19:26:51,"isnt there always ebola in uganda",2022-10-07 19:00:00
"14","1578466294680018944","We all know the 2018 caravan. But the way in which cable news went absolute apeshit over Ebola in 2014 is just nuts in retrospect.

Two people died from the outbreak in the US - for perspective, more Americans will die from COVID in the next 5 minutes than that entire outbreak. https://t.co/4Wj1dnX5a9","en","595739003",2022-10-07 19:24:25,"we all know thecaravan but the way in which cable news went absolute apeshit over ebola inis just nuts in retrospect  two people died from the outbreak in the usfor perspective more americans will die from covid in the nextminutes than that entire outbreak",2022-10-07 19:00:00
"15","1578466145891340288","@karenhunter is it the Ebola they are looking for or the gold from Uganda?","en","1574590530276577280",2022-10-07 19:23:50,"is it the ebola they are looking for or the gold from uganda",2022-10-07 19:00:00
"16","1578465961547481094","@PeterObi Obi - Datti family should ensure officials of the campaign organization are tested Nigerians who has no APC/ PDP ebola.","en","1571133094857506818",2022-10-07 19:23:06,"obidatti family should ensure officials of the campaign organization are tested nigerians who has no apc pdp ebola",2022-10-07 19:00:00
"17","1578465915116883968","@CTVNews I guess the Mon(k)eypox scare didn't take traction. So, we got an Ebola jab coming, I assume?","en","577622223",2022-10-07 19:22:55,"i guess the monkeypox scare didnt take traction so we got an ebola jab coming i assume",2022-10-07 19:00:00
"18","1578465858888036352","Dear Ebola,

Let your haters be your motivators.

Let your deniers be your suppliers.

Let the minimizers be your mobilizers.

Sincerely,

Covid","en","1505200770366509056",2022-10-07 19:22:41,"dear ebola  let your haters be your motivators  let your deniers be your suppliers  let the minimizers be your mobilizers  sincerely  covid",2022-10-07 19:00:00
"19","1578465770753101824","#Africa CD, WHO to host regional meeting on Ebola in Uganda https://t.co/Z8zV555Qpj","en","1575394305644298240",2022-10-07 19:22:20,"africa cd who to host regional meeting on ebola in uganda",2022-10-07 19:00:00
"20","1578465636497641472","@FiatLuxGenesis So they're backing off nukes in favor of Ebola?","en","1569113739571388420",2022-10-07 19:21:48,"so theyre backing off nukes in favor of ebola",2022-10-07 19:00:00
"21","1578465584890904576","Biden Administration Orders Airport Ebola Screenings Amidst Deadly Ugandan Outbreak

Here it comes folks…you wondered how ‘they’ would do it next month…this could be it. https://t.co/cBKX2YMxex","en","1519449691901116442",2022-10-07 19:21:36,"biden administration orders airpo ebola screenings amidst deadly ugandan outbreak  here it comes folksyou wondered how they would do it next monththis could be it",2022-10-07 19:00:00
"22","1578465542133776384","@co2detective3 @lisa_iannattone It needs to be transmitted to cause an outbreak and transmission is by contact. Any cases that happen to make it here will be quickly contained. https://t.co/c6SJFjRF2n","en","985321824539021313",2022-10-07 19:21:26,"it needs to be transmitted to cause an outbreak and transmission is by contact any cases that happen to make it here will be quickly contained",2022-10-07 19:00:00
"23","1578465494474010624","Travelers coming to the U.S. from Uganda will face enhanced screening for Ebola https://t.co/EyBvrK07o7","en","1519858645441277952",2022-10-07 19:21:15,"travelers coming to the us from uganda will face enhanced screening for ebola",2022-10-07 19:00:00
"24","1578465340215926785","CDC, WHO, Uganda to host regional meeting as Ebola spreads https://t.co/7S2BR4b84s https://t.co/yiLQALrVk5","en","203123011",2022-10-07 19:20:38,"cdc who uganda to host regional meeting as ebola spreads",2022-10-07 19:00:00
"25","1578465296066543616","Biden Administration Orders Airport Ebola Screenings Amidst Deadly Ugandan Outbreak https://t.co/VNhk8gtBmy","en","185115193",2022-10-07 19:20:27,"biden administration orders airpo ebola screenings amidst deadly ugandanoutbreak",2022-10-07 19:00:00
"26","1578465188449120256","“Given what we know about the ongoing SARS-CoV-2 GOF research &amp; yes, its still ongoing, I believe we can assume that such research is also being conducted with the Ebola virus. This is downright frightening and we deserve answers”

https://t.co/CJfWZKOYEK https://t.co/SxOxt47jb2","en","835312153175392258",2022-10-07 19:20:02,"given what we know about the ongoing sarscov gof research amp yes its still ongoing i believe we can assume that such research is also being conducted with the ebola virus this is downright frightening and we deserve answers  ",2022-10-07 19:00:00
"27","1578465066290073600","@ScienceBotikus Whoa! Did you know:  The Ebola virus kills 4 out of every 5 humans it infects. @ScienceBotikus","en","1452689952018509828",2022-10-07 19:19:32,"whoa did you knowthe ebola virus killsout of everyhumans it infects",2022-10-07 19:00:00
"28","1578465018621751296","@SteamGamesPC what happened to Ebola 1????","en","883704454280871937",2022-10-07 19:19:21,"what happened to ebola",2022-10-07 19:00:00
"29","1578464942940123136","Biden Administration Orders Airport Ebola Screenings Amidst Deadly Ugandan Outbreak https://t.co/CTVPdOODkN","en","1215486846798569473",2022-10-07 19:19:03,"biden administration orders airpo ebola screenings amidst deadly ugandan outbreak",2022-10-07 19:00:00
"30","1578464842490343424","@Craig_A_Spencer Ahh... This looks suspiciously airborne,  between species....(ALL became infected)..and contagious. Ebola https://t.co/v70mmTTW8N","en","1492201481788739584",2022-10-07 19:18:39,"ahh this looks suspiciously airbornebetween speciesall became infectedand contagious ebola",2022-10-07 19:00:00
"31","1578464686584258561","During the past two midterms, the last month of the campaign was consumed by absolute hysteria. Fox led the way - but other networks made the choice to follow.

I talked to @ParkerMolloy about Ebola, caravans, and why we need to be ready for Foxtober: https://t.co/1SpDYrsqqY","en","595739003",2022-10-07 19:18:02,"during the past two midterms the last month of the campaign was consumed by absolute hysteria fox led the waybut other networks made the choice to follow  i talked toabout ebola caravans and why we need to be ready for foxtober",2022-10-07 19:00:00
"32","1578464451753541632","What we know about the unfolding Ebola outbreak in Uganda 

#MedPub #MedTwitter #MedEd #MedNews
https://t.co/yRIYz1MRj9","en","1271686381505581056",2022-10-07 19:17:06,"what we know about the unfolding ebola outbreak in uganda   medpub medtwitter meded mednews ",2022-10-07 19:00:00
"33","1578464360808054784","HERE WE GO AGAIN NHS warned to be 'vigilant' of Ebola and shore up supplies of PPE as Uganda outbreak grows  https://t.co/4wolZ9nkCY","en","1437876272387051520",2022-10-07 19:16:44,"here we go again nhs warned to be vigilant of ebola and shore up supplies of ppe as uganda outbreak grows",2022-10-07 19:00:00
"34","1578464215106347008","#Biden Administration Orders Airport Ebola Screenings Amidst Deadly Ugandan Outbreak #Buzzerly #TwitterAlternative https://t.co/95FUJiEvWq","en","1394995672340893697",2022-10-07 19:16:09,"biden administration orders airpo ebola screenings amidst deadly ugandan outbreak buzzerly twitteralternative",2022-10-07 19:00:00
"35","1578464195548688384","@berrycrypt Only 8.210 evd","en","1562446482833575936",2022-10-07 19:16:05,"onlyevd",2022-10-07 19:00:00
"36","1578463943302950913","Ugandan health authorities are setting up emergency response teams, isolation centres, and treatment tents in 20 places around the central Mubende district after the first death from a new outbreak of Ebola virus disease was announced on 19 September
https://t.co/RWeJ0TMRDa","en","16949344",2022-10-07 19:15:05,"ugandan health authorities are setting up emergency response teams isolation centres and treatment tents inplaces around the central mubende district after the first death from a new outbreak of ebola virus disease was announced onseptember ",2022-10-07 19:00:00
"37","1578463864743636992","For the first time in 10 years, a rare Ebola strain for which there is no approved vaccine is infecting and killing dozens of people in Uganda.

@HerbScribner has a great explainer of the situation, as well as necessary historical context:

https://t.co/E4e4CR1T2Z","en","498549828",2022-10-07 19:14:46,"for the first time inyears a rare ebola strain for which there is no approved vaccine is infecting and killing dozens of people in uganda   has a great explainer of the situation as well as necessary historical context  ",2022-10-07 19:00:00
"38","1578463842186985472","@JustinTrudeau @UN @UNHumanRights kids safe. Disabled marked for death in Canada. No one protecting any act, legislation, rights. SOS SOS. This country is UNSAFE. Ebola being ignored. @DrTedros KIDS IN CANADA being endangered, ALL levels, agencies, refuse to provide SAFE environments.","en","1443670104135323652",2022-10-07 19:14:41,"kids safe disabled marked for death in canada no one protecting any act legislation rights sos sos this country is unsafe ebola being ignoredkids in canada being endangered all levels agencies refuse to provide safe environments",2022-10-07 19:00:00
"39","1578463727908966401","The NHS has warned to be “vigilant” about Ebola as America introduces airport screening https://t.co/nIvbWGzatO","en","1570369772147150849",2022-10-07 19:14:13,"the nhs has warned to be vigilant about ebola as america introduces airposcreening",2022-10-07 19:00:00
"40","1578463609700511744","The U.S. will start screening passengers from Uganda for Ebola as the African country deals with an outbreak https://t.co/iuzX25u3fs","en","1519268661734780928",2022-10-07 19:13:45,"the us will sta screening passengers from uganda for ebola as the african country deals with anoutbreak",2022-10-07 19:00:00
"41","1578463567036108801","@fragiledogubo @Damaker01 @Violettaonpoint She ain't the only doctor that died of ebola so rest.","en","1233494246180769795",2022-10-07 19:13:35,"she aint the only doctor that died of ebola so rest",2022-10-07 19:00:00
"42","1578463236306784256","Airline passengers arriving to the US from Uganda will be routed through five airports for Ebola screening

@karenhunter @DanteNero #KarenRebels 

https://t.co/DRoOU48Rvc","en","2293099507",2022-10-07 19:12:16,"airline passengers arriving to the us from uganda will be routed through five airpos for ebola screening  karenrebels   ",2022-10-07 19:00:00
"43","1578463221484175360","Ebola: This is Not ""Over"" https://t.co/xvpoHfrbxx","en","707938453",2022-10-07 19:12:13,"ebola this is not over",2022-10-07 19:00:00
"44","1578462913534185472","@BCprecisionreps @NottaSheep @MarkBrigham @SoCalValleyGal @robreiner @RonDeSantisFL Tweet is not enough to answer so many misstatements. Ebola/deadly/spreading like wildfire,stopped at the source and at our borders by SWIFT actions,not denial.
Covid &lt;lethal due to vaccines. Containment helped until vaccines developed and disease understood.Masks help even w/flu.","en","814078857980604416",2022-10-07 19:10:59,"tweet is not enough to answer so many misstatements eboladeadlyspreading like wildfirestopped at the source and at our borders by swift actionsnot denial covid ltlethal due to vaccines containment helped until vaccines developed and disease understoodmasks help even wflu",2022-10-07 19:00:00
"45","1578462681811415041","The latest Everything Prepping! https://t.co/l1Q7kPJ49h Thanks to @TribuneAgency @namshine @Pilgrimgrandma #ebola #uganda","en","2806425639",2022-10-07 19:10:04,"the latest everything preppingthanks toebola uganda",2022-10-07 19:00:00
"46","1578462667991568384","U.S. to begin screening travellers coming from Uganda for Ebola https://t.co/uODdkntdOY","en","711914061072625665",2022-10-07 19:10:01,"us to begin screening travellers coming from uganda for ebola",2022-10-07 19:00:00
"47","1578462566350667776","@LauraMiers @sleepyknave @lisa_iannattone Yes and the “someone sick with Ebola” (in the 2nd paragraph) could literally be anyone who isn’t yet very symptomatic - and they must know that.","en","1401216844414001157",2022-10-07 19:09:36,"yes and the someone sick with ebola in the nd paragraph could literally be anyone who isnt yet very symptomaticand they must know that",2022-10-07 19:00:00
"48","1578462477440135168","USA HCWs UNIVERSAL PRECAUTIONS!

""Uganda Health Minister..announced the 1st death of a doctor, a 37-year-old from Tanzania who tested positive for Ebola on Sep 26 and died while receiving treatment. The other is a midwife from St Florence Clinic who is listed as a probable case.""","en","1411668290154504196",2022-10-07 19:09:15,"usa hcws universal precautions  uganda health ministerannounced the st death of a doctor a yearold from tanzania who tested positive for ebola on sepand died while receiving treatment the other is a midwife from st florence clinic who is listed as a probable case",2022-10-07 19:00:00
"49","1578462325300166663","@gobelino1 @lisa_iannattone Ebola-Reston is mildly symptomatic when compared to Ebola-Zaire and is not fatal in humans.","en","1508455788",2022-10-07 19:08:39,"ebolareston is mildly symptomatic when compared to ebolazaire and is not fatal in humans",2022-10-07 19:00:00
"50","1578462166642229248","Clinicians: Ugandan MOH confirmed an outbreak of Ebola on September 20. Although the risk of Ebola in the US is low, remember to ask your patients for a travel history and work with your state and local health depts if you suspect a case. https://t.co/rjKR2zFji6 https://t.co/k1c0ECnL79","en","1262167370",2022-10-07 19:08:01,"clinicians ugandan moh confirmed an outbreak of ebola on septemberalthough the risk of ebola in the us is low remember to ask your patients for a travel history and work with your state and local health depts if you suspect a case",2022-10-07 19:00:00
"51","1578462136514191360","@FoxNews So the Twitter people/network who push ENDLESS fear mongering, lies, over exaggerated about EBOLA. Are now concerned about Biden's telling American the truth about Trump's Crazy friend Putin mentality. https://t.co/ZaMCtx6wFe","en","523871901",2022-10-07 19:07:54,"so the twitter peoplenetwork who push endless fear mongering lies over exaggerated about ebola are now concerned about bidens telling american the truth about trumps crazy friend putin mentality",2022-10-07 19:00:00
"52","1578461978557046785","Ebola outbreak in Uganda: how worried are researchers? https://t.co/NaSAuCh1Lg","en","473328336",2022-10-07 19:07:16,"ebola outbreak in uganda how worried areresearchers",2022-10-07 19:00:00
"53","1578461768913162242","@jrbyoung Ok, ocd make me look it up. 🤣
Outbreak the Film was based on Hot Zone the Book.  Outbreak the novel, is unrelated to the film but was a separate story about ebola. https://t.co/G1QZzhapAx","en","339807063",2022-10-07 19:06:26,"ok ocd make me look it up  outbreak the film was based on hot zone the bookoutbreak the novel is unrelated to the film but was a separate story about ebola",2022-10-07 19:00:00
"54","1578461632275140622","Good evening everyone following me,
It's quite alarming that we were affected by adeadly disease Ebola in the areas of Mubende and the neighboring district, how the government has tried her Best to curb the diseases, I still believe that there is a lot that should be done","en","1574437635434708992",2022-10-07 19:05:54,"good evening everyone following me its quite alarming that we were affected by adeadly disease ebola in the areas of mubende and the neighboring district how the government has tried her best to curb the diseases i still believe that there is a lot that should be done",2022-10-07 19:00:00
"55","1578461532777721856","@sleepyknave @TheSkylineTrail @lisa_iannattone They are using very deliberate language &amp; precise distance here…https://t.co/mgU3ZAqX3c https://t.co/BNWM7zdz8M","en","170280910",2022-10-07 19:05:30,"they are using very deliberate language amp precise distance here",2022-10-07 19:00:00
"56","1578461353177911296","Ebola: This is Not ""Over"" https://t.co/8TDUiwkVot","en","65767300",2022-10-07 19:04:47,"ebola this is not over",2022-10-07 19:00:00
"57","1578461307367395328","NEW from me &gt;&gt; What we know about the unfolding Ebola outbreak in Uganda https://t.co/NUIIqYPnUp","en","2375841180",2022-10-07 19:04:36,"new from me gtgt what we know about the unfolding ebola outbreak in uganda",2022-10-07 19:00:00
"58","1578461292704464896","Stopping The Uganda Ebola Outbreak Now Should Be A Global Priority https://t.co/9V5D1onONb","en","1516832544125190145",2022-10-07 19:04:33,"stopping the uganda ebola outbreak now should be a global priority",2022-10-07 19:00:00
"59","1578461165193031680","RINSE. REPEAT. REGRET. Do travel restrictions work? Do they actually discourage countries from being transparent about scale of outbreak due to fear of sanctions? 

These questions come to the fore again after the outbreak in Ebola in Uganda. 
#ebola #uganda https://t.co/hOnJH8XRpK","en","1575805677272170496",2022-10-07 19:04:02,"rinse repeat regret do travel restrictions work do they actually discourage countries from being transparent about scale of outbreak due to fear of sanctions   these questions come to the fore again after the outbreak in ebola in uganda  ebola uganda",2022-10-07 19:00:00
"60","1578461081965498368","From ‘dad isn’t feeling to good’ to ‘dad has to stay in the hospital for atleast 2 days’ it’s been an interesting one but atleast he was negative for Ebola, malaria and Covid. (He went to Uganda with the Red Cross for a week)","en","4861089804",2022-10-07 19:03:42,"from dad isnt feeling to good to dad has to stay in the hospital for atleastdays its been an interesting one but atleast he was negative for ebola malaria and covid he went to uganda with the red cross for a week",2022-10-07 19:00:00
"61","1578460886561619968","I wrote about the Ebola outbreak in Uganda and how these crises will continue to happen until we treat them as such. The only way out is to build up poor countries' health systems irrespective of emergencies, so they are strong when crises emerge. https://t.co/dNBgX6NHtP","en","15099007",2022-10-07 19:02:56,"i wrote about the ebola outbreak in uganda and how these crises will continue to happen until we treat them as such the only way out is to build up poor countries health systems irrespective of emergencies so they are strong when crises emerge",2022-10-07 19:00:00
"62","1578460880760500224","@psiphi_gavagai @LynAldenContact @tobias_steurer6 @cosmos Mother Nature wants to thin our herd she knows our path is unsustainable.

We now have Ebola cholera polio monkeypox popping up

Most humans don’t seem to grasp this.","en","1467694088321441794",2022-10-07 19:02:55,"mother nature wants to thin our herd she knows our path is unsustainable  we now have ebola cholera polio monkeypox popping up  most humans dont seem to grasp this",2022-10-07 19:00:00
"63","1578460783016452096","@CahnEmily Our children are in their 30’s now. We used to joke that we were all probably immune to Ebola.
It gets better.","en","824664733185933312",2022-10-07 19:02:31,"our children are in their s now we used to joke that we were all probably immune to ebola it gets better",2022-10-07 19:00:00
"64","1578460586467201024","If there is one person one should read regarding Ebola, it’s Craig. https://t.co/JRdMrUolOn","en","795403887905738752",2022-10-07 19:01:44,"if there is one person one should read regarding ebola its craig",2022-10-07 19:00:00
"65","1578460461774692352","Ebola and Nuclear War trending. I read this story in High School.","en","887741275230711809",2022-10-07 19:01:15,"ebola and nuclear war trending i read this story in high school",2022-10-07 19:00:00
"66","1578460338978459649","@nbstv @WHO @MinofHealthUG @MugenyiHenry_ Great job but it won't change their decision.Ebola is like a bad news paper article that never goes away..

CNN has been reporting this a few times now. 

My Uganda is good at managing viruses still.","en","1267394362603966465",2022-10-07 19:00:45,"great job but it wont change their decisionebola is like a bad news paper aicle that never goes away  cnn has been repoing this a few times now   my uganda is good at managing viruses still",2022-10-07 19:00:00
"67","1578460252164718592","Source for Ebola Virus Disease (EVD) Case-Fatality Rate of 44% (27 dead/ 62 cases):

CIDRAP, University of Minnesota, October 3, 2022:

https://t.co/yfEZfzeWro","en","1411668290154504196",2022-10-07 19:00:25,"source for ebola virus disease evd casefatality rate ofdeadcases  cidrap university of minnesota october  ",2022-10-07 19:00:00
"68","1578460249249714176","Current EVD case-fatality rate 44%:

""The new developments lift the country's overall total to 62 cases, 27 of them fatal. Of the 62 cases, 43 are lab-confirmed and 19 are listed as probable. Of the 27 deaths, 9 were in lab-confirmed patients, and 18 are classified as probable.""","en","1411668290154504196",2022-10-07 19:00:24,"current evd casefatality rate   the new developments lift the countrys overall total tocasesof them fatal of thecasesare labconfirmed andare listed as probable of thedeathswere in labconfirmed patients andare classified as probable",2022-10-07 19:00:00
"69","1578460205872214016","The RSB Show 10-7-22 - Kid COVID antibodies, U.S. stockpiling radiation meds, Tainted blood supply, Herpes options, Peter McCullough banned, Ebola warnings https://t.co/gIRS9EkGLu","en","80741093",2022-10-07 19:00:14,"the rsb showkid covid antibodies us stockpiling radiation meds tainted blood supply herpes options peter mccullough banned ebola warnings",2022-10-07 19:00:00
